{
  "protocol": "oncode-tool/1.0",
  "message_type": "EVENT",
  "message_id": "MSG-018f0000-0000-7000-8000-000000000004",
  "timestamp": "2026-09-09T07:00:02.000Z",
  "session_id": "SES-018f0000-0000-7000-8000-000000000010",
  "workflow_id": "WF-018f0000-0000-7000-8000-000000000013",
  "work_item_id": "WI-018f0000-0000-7000-8000-000000000014",
  "payload": {
    "event": "workflow.stage.changed",
    "data": { "stage": "DESIGNING", "status": "RUNNING" }
  }
}
